<productsList xmlns:xsi="http://www.w3.org/2001/XMLSchema-instance"
    xsi:noNamespaceSchemaLocation="data.xsd">
    <product id="1">
        <name>product1</name>
        <price>12</price>
        <description>this is product1</description>
    </product>
    <product id="2">
        <name>product2</name>
        <price>14</price>
        <description>this is product2</description>
    </product>
    <product id="3">
        <name>product3</name>
        <price>16</price>
    </product>
    <product id="4">
        <name>product4</name>
        <price>18</price>
    </product>
    <product id="5">
        <name>product5</name>
        <price>20</price>
        <description>this is product5</description>
    </product>
</productsList>